"No.","Time","Source","Destination","Protocol","Length","Info"
"1","0.000000","Apple_03:1f:11","Broadcast","ARP","42","Who has 10.8.113.245? Tell 10.8.227.69"
"2","0.085023","Microsof_bf:a2:1c","Apple_03:1f:11","ARP","42","10.8.113.245 is at b4:ae:2b:bf:a2:1c"
"3","0.085075","10.8.227.69","10.8.113.245","TCP","66","50559  >  8001 [SYN] Seq=0 Win=64240 Len=0 MSS=1460 WS=256 SACK_PERM=1"
"4","0.087927","10.8.113.245","10.8.227.69","TCP","66","8001  >  50559 [SYN, ACK] Seq=0 Ack=1 Win=8192 Len=0 MSS=1386 WS=256 SACK_PERM=1"
"5","0.088107","10.8.227.69","10.8.113.245","TCP","54","50559  >  8001 [ACK] Seq=1 Ack=1 Win=66304 Len=0"
"6","0.091866","10.8.227.69","10.8.113.245","TCP","54","[TCP Window Update] 50559  >  8001 [ACK] Seq=1 Ack=1 Win=131072 Len=0"
"7","0.092199","10.8.227.69","10.8.113.245","TCP","78","50559  >  8001 [PSH, ACK] Seq=1 Ack=1 Win=131072 Len=24"
"8","0.106059","10.8.113.245","10.8.227.69","TCP","78","8001  >  50559 [PSH, ACK] Seq=1 Ack=25 Win=66304 Len=24"
"9","0.114524","10.8.113.245","10.8.227.69","TCP","138","8001  >  50559 [PSH, ACK] Seq=25 Ack=25 Win=66304 Len=84"
"10","0.114626","10.8.227.69","10.8.113.245","TCP","54","50559  >  8001 [ACK] Seq=25 Ack=109 Win=130816 Len=0"
"11","0.114961","10.8.113.245","10.8.227.69","TCP","82","8001  >  50559 [PSH, ACK] Seq=109 Ack=25 Win=66304 Len=28"
"12","0.115241","10.8.227.69","10.8.113.245","TCP","82","50559  >  8001 [PSH, ACK] Seq=25 Ack=137 Win=130816 Len=28"
"13","0.174532","10.8.113.245","10.8.227.69","TCP","54","8001  >  50559 [ACK] Seq=137 Ack=53 Win=66304 Len=0"
"14","0.174578","10.8.227.69","10.8.113.245","TCP","110","50559  >  8001 [PSH, ACK] Seq=53 Ack=137 Win=130816 Len=56"
"15","0.178907","10.8.113.245","10.8.227.69","TCP","94","8001  >  50559 [PSH, ACK] Seq=137 Ack=109 Win=66304 Len=40"
"16","0.179189","10.8.227.69","10.8.113.245","TCP","190","50559  >  8001 [PSH, ACK] Seq=109 Ack=177 Win=130816 Len=136"
"17","0.180842","10.8.113.245","10.8.227.69","TCP","134","8001  >  50559 [PSH, ACK] Seq=177 Ack=109 Win=66304 Len=80"
"18","0.180896","10.8.227.69","10.8.113.245","TCP","130","50559  >  8001 [PSH, ACK] Seq=245 Ack=257 Win=130816 Len=76"
"19","0.181119","10.8.113.245","10.8.227.69","TCP","82","8001  >  50559 [PSH, ACK] Seq=257 Ack=109 Win=66304 Len=28"
"20","0.184505","10.8.113.245","10.8.227.69","TCP","134","8001  >  50559 [PSH, ACK] Seq=285 Ack=245 Win=66304 Len=80"
"21","0.184560","10.8.227.69","10.8.113.245","TCP","82","50559  >  8001 [PSH, ACK] Seq=321 Ack=365 Win=130560 Len=28"
"22","0.184849","10.8.113.245","10.8.227.69","TCP","82","8001  >  50559 [PSH, ACK] Seq=365 Ack=245 Win=66304 Len=28"
"23","0.184850","10.8.113.245","10.8.227.69","TCP","134","8001  >  50559 [PSH, ACK] Seq=393 Ack=245 Win=66304 Len=80"
"24","0.184850","10.8.113.245","10.8.227.69","TCP","82","8001  >  50559 [PSH, ACK] Seq=473 Ack=245 Win=66304 Len=28"
"25","0.184883","10.8.227.69","10.8.113.245","TCP","82","50559  >  8001 [PSH, ACK] Seq=349 Ack=501 Win=130560 Len=28"
"26","0.186040","10.8.113.245","10.8.227.69","TCP","134","8001  >  50559 [PSH, ACK] Seq=501 Ack=245 Win=66304 Len=80"
"27","0.186040","10.8.113.245","10.8.227.69","TCP","82","8001  >  50559 [PSH, ACK] Seq=581 Ack=245 Win=66304 Len=28"
"28","0.186069","10.8.227.69","10.8.113.245","TCP","82","50559  >  8001 [PSH, ACK] Seq=377 Ack=609 Win=130304 Len=28"
"29","0.187222","10.8.113.245","10.8.227.69","TCP","134","8001  >  50559 [PSH, ACK] Seq=609 Ack=245 Win=66304 Len=80"
"30","0.187260","10.8.227.69","10.8.113.245","TCP","82","50559  >  8001 [PSH, ACK] Seq=405 Ack=689 Win=130304 Len=28"
"31","0.187700","10.8.113.245","10.8.227.69","TCP","82","8001  >  50559 [PSH, ACK] Seq=689 Ack=321 Win=66048 Len=28"
"32","0.187730","10.8.227.69","10.8.113.245","TCP","82","50559  >  8001 [PSH, ACK] Seq=433 Ack=717 Win=130304 Len=28"
"33","0.188412","10.8.113.245","10.8.227.69","TCP","134","8001  >  50559 [PSH, ACK] Seq=717 Ack=321 Win=66048 Len=80"
"34","0.189554","10.8.113.245","10.8.227.69","TCP","82","8001  >  50559 [PSH, ACK] Seq=797 Ack=321 Win=66048 Len=28"
"35","0.189555","10.8.113.245","10.8.227.69","TCP","54","8001  >  50559 [ACK] Seq=825 Ack=377 Win=66048 Len=0"
"36","0.189608","10.8.227.69","10.8.113.245","TCP","82","50559  >  8001 [PSH, ACK] Seq=461 Ack=825 Win=130048 Len=28"
"37","0.190773","10.8.113.245","10.8.227.69","TCP","134","8001  >  50559 [PSH, ACK] Seq=825 Ack=377 Win=66048 Len=80"
"38","0.191959","10.8.113.245","10.8.227.69","TCP","82","8001  >  50559 [PSH, ACK] Seq=905 Ack=377 Win=66048 Len=28"
"39","0.191993","10.8.227.69","10.8.113.245","TCP","82","50559  >  8001 [PSH, ACK] Seq=489 Ack=933 Win=130048 Len=28"
"40","0.192732","10.8.113.245","10.8.227.69","TCP","86","8001  >  50559 [PSH, ACK] Seq=933 Ack=377 Win=66048 Len=32"
"41","0.193300","10.8.113.245","10.8.227.69","TCP","54","8001  >  50559 [ACK] Seq=965 Ack=433 Win=66048 Len=0"
"42","0.193336","10.8.227.69","10.8.113.245","TCP","86","50559  >  8001 [PSH, ACK] Seq=517 Ack=965 Win=130048 Len=32"
"43","0.193568","10.8.113.245","10.8.227.69","TCP","86","8001  >  50559 [PSH, ACK] Seq=965 Ack=433 Win=66048 Len=32"
"44","0.195439","10.8.113.245","10.8.227.69","TCP","86","8001  >  50559 [PSH, ACK] Seq=997 Ack=461 Win=66048 Len=32"
"45","0.195494","10.8.227.69","10.8.113.245","TCP","86","50559  >  8001 [PSH, ACK] Seq=549 Ack=1029 Win=129792 Len=32"
"46","0.195728","10.8.113.245","10.8.227.69","TCP","130","8001  >  50559 [PSH, ACK] Seq=1029 Ack=489 Win=66048 Len=76"
"47","0.195729","10.8.113.245","10.8.227.69","TCP","82","8001  >  50559 [PSH, ACK] Seq=1105 Ack=489 Win=66048 Len=28"
"48","0.195760","10.8.227.69","10.8.113.245","TCP","86","50559  >  8001 [PSH, ACK] Seq=581 Ack=1133 Win=129792 Len=32"
"49","0.196911","10.8.113.245","10.8.227.69","TCP","86","8001  >  50559 [PSH, ACK] Seq=1133 Ack=489 Win=66048 Len=32"
"50","0.197075","10.8.113.245","10.8.227.69","TCP","86","8001  >  50559 [PSH, ACK] Seq=1165 Ack=489 Win=66048 Len=32"
"51","0.197091","10.8.227.69","10.8.113.245","TCP","54","50559  >  8001 [ACK] Seq=613 Ack=1197 Win=129792 Len=0"
"52","0.199102","10.8.113.245","10.8.227.69","TCP","54","8001  >  50559 [ACK] Seq=1197 Ack=549 Win=65792 Len=0"
"53","0.199103","10.8.113.245","10.8.227.69","TCP","134","8001  >  50559 [PSH, ACK] Seq=1197 Ack=549 Win=65792 Len=80"
"54","0.199275","10.8.113.245","10.8.227.69","TCP","82","8001  >  50559 [PSH, ACK] Seq=1277 Ack=549 Win=65792 Len=28"
"55","0.199298","10.8.227.69","10.8.113.245","TCP","54","50559  >  8001 [ACK] Seq=613 Ack=1305 Win=129536 Len=0"
"56","0.200185","10.8.113.245","10.8.227.69","TCP","86","8001  >  50559 [PSH, ACK] Seq=1305 Ack=549 Win=65792 Len=32"
"57","0.200613","10.8.113.245","10.8.227.69","TCP","86","8001  >  50559 [PSH, ACK] Seq=1337 Ack=549 Win=65792 Len=32"
"58","0.200631","10.8.227.69","10.8.113.245","TCP","54","50559  >  8001 [ACK] Seq=613 Ack=1369 Win=129536 Len=0"
"59","0.201204","10.8.113.245","10.8.227.69","TCP","54","8001  >  50559 [ACK] Seq=1369 Ack=613 Win=65792 Len=0"
"60","0.203806","10.8.227.69","10.8.113.245","TCP","82","50559  >  8001 [PSH, ACK] Seq=613 Ack=1369 Win=129536 Len=28"
"61","0.257997","10.8.113.245","10.8.227.69","TCP","54","8001  >  50559 [ACK] Seq=1369 Ack=641 Win=65792 Len=0"
"62","0.258064","10.8.227.69","10.8.113.245","TCP","462","50559  >  8001 [PSH, ACK] Seq=641 Ack=1369 Win=129536 Len=408"
"63","0.263264","10.8.113.245","10.8.227.69","TCP","86","8001  >  50559 [PSH, ACK] Seq=1369 Ack=1049 Win=65280 Len=32"
"64","0.263529","10.8.227.69","10.8.113.245","TCP","86","50559  >  8001 [PSH, ACK] Seq=1049 Ack=1401 Win=131072 Len=32"
"65","0.264139","10.8.113.245","10.8.227.69","TCP","114","8001  >  50559 [PSH, ACK] Seq=1401 Ack=1049 Win=65280 Len=60"
"66","0.295283","10.8.113.245","10.8.227.69","TCP","1254","8001  >  50559 [PSH, ACK] Seq=1461 Ack=1081 Win=65280 Len=1200"
"67","0.295341","10.8.227.69","10.8.113.245","TCP","158","50559  >  8001 [PSH, ACK] Seq=1081 Ack=2661 Win=129792 Len=104"
"68","0.305330","10.8.113.245","10.8.227.69","TCP","266","8001  >  50559 [PSH, ACK] Seq=2661 Ack=1185 Win=65280 Len=212"
"69","0.310070","10.8.113.245","10.8.227.69","TCP","1434","8001  >  50559 [PSH, ACK] Seq=2873 Ack=1185 Win=65280 Len=1380"
"70","0.310101","10.8.227.69","10.8.113.245","TCP","54","50559  >  8001 [ACK] Seq=1185 Ack=4253 Win=131072 Len=0"
"71","0.311065","10.8.113.245","10.8.227.69","TCP","1434","8001  >  50559 [PSH, ACK] Seq=4253 Ack=1185 Win=65280 Len=1380"
"72","0.311712","10.8.113.245","10.8.227.69","TCP","1434","8001  >  50559 [PSH, ACK] Seq=5633 Ack=1185 Win=65280 Len=1380"
"73","0.311773","10.8.227.69","10.8.113.245","TCP","54","50559  >  8001 [ACK] Seq=1185 Ack=7013 Win=131072 Len=0"
"74","0.312203","10.8.113.245","10.8.227.69","TCP","1440","8001  >  50559 [ACK] Seq=7013 Ack=1185 Win=65280 Len=1386"
"75","0.312679","10.8.113.245","10.8.227.69","TCP","1428","8001  >  50559 [PSH, ACK] Seq=8399 Ack=1185 Win=65280 Len=1374"
"76","0.312701","10.8.227.69","10.8.113.245","TCP","54","50559  >  8001 [ACK] Seq=1185 Ack=9773 Win=131072 Len=0"
"77","0.312839","10.8.113.245","10.8.227.69","TCP","946","8001  >  50559 [PSH, ACK] Seq=9773 Ack=1185 Win=65280 Len=892"
"78","0.320980","10.8.113.245","10.8.227.69","TCP","266","8001  >  50559 [PSH, ACK] Seq=10665 Ack=1185 Win=65280 Len=212"
"79","0.321023","10.8.227.69","10.8.113.245","TCP","54","50559  >  8001 [ACK] Seq=1185 Ack=10877 Win=129792 Len=0"
"80","0.325483","10.8.113.245","10.8.227.69","TCP","98","8001  >  50559 [PSH, ACK] Seq=10877 Ack=1185 Win=65280 Len=44"
"81","0.342799","10.8.113.245","10.8.227.69","TCP","266","8001  >  50559 [PSH, ACK] Seq=10921 Ack=1185 Win=65280 Len=212"
"82","0.342801","10.8.113.245","10.8.227.69","TCP","194","8001  >  50559 [PSH, ACK] Seq=11133 Ack=1185 Win=65280 Len=140"
"83","0.342861","10.8.227.69","10.8.113.245","TCP","54","50559  >  8001 [ACK] Seq=1185 Ack=11273 Win=131072 Len=0"
"84","0.354434","10.8.113.245","10.8.227.69","TCP","266","8001  >  50559 [PSH, ACK] Seq=11273 Ack=1185 Win=65280 Len=212"
"85","0.354490","10.8.227.69","10.8.113.245","TCP","54","50559  >  8001 [ACK] Seq=1185 Ack=11485 Win=130816 Len=0"
"86","0.370692","10.8.113.245","10.8.227.69","TCP","266","8001  >  50559 [PSH, ACK] Seq=11485 Ack=1185 Win=65280 Len=212"
"87","0.389276","10.8.113.245","10.8.227.69","TCP","266","8001  >  50559 [PSH, ACK] Seq=11697 Ack=1185 Win=65280 Len=212"
"88","0.389321","10.8.227.69","10.8.113.245","TCP","54","50559  >  8001 [ACK] Seq=1185 Ack=11909 Win=130304 Len=0"
"89","0.404135","10.8.113.245","10.8.227.69","TCP","266","8001  >  50559 [PSH, ACK] Seq=11909 Ack=1185 Win=65280 Len=212"
"90","0.417169","10.8.113.245","10.8.227.69","TCP","166","8001  >  50559 [PSH, ACK] Seq=12121 Ack=1185 Win=65280 Len=112"
"91","0.417227","10.8.227.69","10.8.113.245","TCP","54","50559  >  8001 [ACK] Seq=1185 Ack=12233 Win=130048 Len=0"
"92","0.426332","10.8.113.245","10.8.227.69","TCP","266","8001  >  50559 [PSH, ACK] Seq=12233 Ack=1185 Win=65280 Len=212"
"93","0.437175","10.8.113.245","10.8.227.69","TCP","266","8001  >  50559 [PSH, ACK] Seq=12445 Ack=1185 Win=65280 Len=212"
"94","0.437218","10.8.227.69","10.8.113.245","TCP","54","50559  >  8001 [ACK] Seq=1185 Ack=12657 Win=129536 Len=0"
"95","0.453858","10.8.113.245","10.8.227.69","TCP","266","8001  >  50559 [PSH, ACK] Seq=12657 Ack=1185 Win=65280 Len=212"
"96","0.458316","10.8.113.245","10.8.227.69","TCP","194","8001  >  50559 [PSH, ACK] Seq=12869 Ack=1185 Win=65280 Len=140"
"97","0.458350","10.8.227.69","10.8.113.245","TCP","54","50559  >  8001 [ACK] Seq=1185 Ack=13009 Win=131072 Len=0"
"98","0.470568","10.8.113.245","10.8.227.69","TCP","266","8001  >  50559 [PSH, ACK] Seq=13009 Ack=1185 Win=65280 Len=212"
"99","0.473846","10.8.113.245","10.8.227.69","TCP","258","8001  >  50559 [PSH, ACK] Seq=13221 Ack=1185 Win=65280 Len=204"
"100","0.473875","10.8.227.69","10.8.113.245","TCP","54","50559  >  8001 [ACK] Seq=1185 Ack=13425 Win=130560 Len=0"
"101","0.478213","10.8.113.245","10.8.227.69","TCP","166","8001  >  50559 [PSH, ACK] Seq=13425 Ack=1185 Win=65280 Len=112"
"102","0.487170","10.8.113.245","10.8.227.69","TCP","266","8001  >  50559 [PSH, ACK] Seq=13537 Ack=1185 Win=65280 Len=212"
"103","0.487200","10.8.227.69","10.8.113.245","TCP","54","50559  >  8001 [ACK] Seq=1185 Ack=13749 Win=130304 Len=0"
"104","0.495941","10.8.113.245","10.8.227.69","TCP","258","8001  >  50559 [PSH, ACK] Seq=13749 Ack=1185 Win=65280 Len=204"
"105","0.503938","10.8.113.245","10.8.227.69","TCP","266","8001  >  50559 [PSH, ACK] Seq=13953 Ack=1185 Win=65280 Len=212"
"106","0.503960","10.8.227.69","10.8.113.245","TCP","54","50559  >  8001 [ACK] Seq=1185 Ack=14165 Win=129792 Len=0"
"107","0.520549","10.8.113.245","10.8.227.69","TCP","266","8001  >  50559 [PSH, ACK] Seq=14165 Ack=1185 Win=65280 Len=212"
"108","0.534299","10.8.113.245","10.8.227.69","TCP","166","8001  >  50559 [PSH, ACK] Seq=14377 Ack=1185 Win=65280 Len=112"
"109","0.534330","10.8.227.69","10.8.113.245","TCP","54","50559  >  8001 [ACK] Seq=1185 Ack=14489 Win=131072 Len=0"
"110","0.537139","10.8.113.245","10.8.227.69","TCP","266","8001  >  50559 [PSH, ACK] Seq=14489 Ack=1185 Win=65280 Len=212"
"111","0.553758","10.8.113.245","10.8.227.69","TCP","266","8001  >  50559 [PSH, ACK] Seq=14701 Ack=1185 Win=65280 Len=212"
"112","0.553802","10.8.227.69","10.8.113.245","TCP","54","50559  >  8001 [ACK] Seq=1185 Ack=14913 Win=130560 Len=0"
"113","0.570518","10.8.113.245","10.8.227.69","TCP","266","8001  >  50559 [PSH, ACK] Seq=14913 Ack=1185 Win=65280 Len=212"
"114","0.587303","10.8.113.245","10.8.227.69","TCP","266","8001  >  50559 [PSH, ACK] Seq=15125 Ack=1185 Win=65280 Len=212"
"115","0.587339","10.8.227.69","10.8.113.245","TCP","54","50559  >  8001 [ACK] Seq=1185 Ack=15337 Win=130048 Len=0"
"116","0.600535","10.8.113.245","10.8.227.69","TCP","166","8001  >  50559 [PSH, ACK] Seq=15337 Ack=1185 Win=65280 Len=112"
"117","0.603947","10.8.113.245","10.8.227.69","TCP","266","8001  >  50559 [PSH, ACK] Seq=15449 Ack=1185 Win=65280 Len=212"
"118","0.603979","10.8.227.69","10.8.113.245","TCP","54","50559  >  8001 [ACK] Seq=1185 Ack=15661 Win=129792 Len=0"
"119","0.620582","10.8.113.245","10.8.227.69","TCP","266","8001  >  50559 [PSH, ACK] Seq=15661 Ack=1185 Win=65280 Len=212"
"120","0.637301","10.8.113.245","10.8.227.69","TCP","266","8001  >  50559 [PSH, ACK] Seq=15873 Ack=1185 Win=65280 Len=212"
"121","0.637332","10.8.227.69","10.8.113.245","TCP","54","50559  >  8001 [ACK] Seq=1185 Ack=16085 Win=131072 Len=0"
"122","0.654436","10.8.113.245","10.8.227.69","TCP","266","8001  >  50559 [PSH, ACK] Seq=16085 Ack=1185 Win=65280 Len=212"
"123","0.674929","10.8.113.245","10.8.227.69","TCP","266","8001  >  50559 [PSH, ACK] Seq=16297 Ack=1185 Win=65280 Len=212"
"124","0.674966","10.8.227.69","10.8.113.245","TCP","54","50559  >  8001 [ACK] Seq=1185 Ack=16509 Win=130560 Len=0"
"125","0.676479","10.8.113.245","10.8.227.69","TCP","166","8001  >  50559 [PSH, ACK] Seq=16509 Ack=1185 Win=65280 Len=112"
"126","0.687188","10.8.113.245","10.8.227.69","TCP","266","8001  >  50559 [PSH, ACK] Seq=16621 Ack=1185 Win=65280 Len=212"
"127","0.687236","10.8.227.69","10.8.113.245","TCP","54","50559  >  8001 [ACK] Seq=1185 Ack=16833 Win=130304 Len=0"
"128","0.703853","10.8.113.245","10.8.227.69","TCP","266","8001  >  50559 [PSH, ACK] Seq=16833 Ack=1185 Win=65280 Len=212"
"129","0.721035","10.8.113.245","10.8.227.69","TCP","266","8001  >  50559 [PSH, ACK] Seq=17045 Ack=1185 Win=65280 Len=212"
"130","0.721129","10.8.227.69","10.8.113.245","TCP","54","50559  >  8001 [ACK] Seq=1185 Ack=17257 Win=129792 Len=0"
"131","0.737199","10.8.113.245","10.8.227.69","TCP","266","8001  >  50559 [PSH, ACK] Seq=17257 Ack=1185 Win=65280 Len=212"
"132","0.753911","10.8.113.245","10.8.227.69","TCP","266","8001  >  50559 [PSH, ACK] Seq=17469 Ack=1185 Win=65280 Len=212"
"133","0.754007","10.8.227.69","10.8.113.245","TCP","54","50559  >  8001 [ACK] Seq=1185 Ack=17681 Win=131072 Len=0"
"134","0.770542","10.8.113.245","10.8.227.69","TCP","266","8001  >  50559 [PSH, ACK] Seq=17681 Ack=1185 Win=65280 Len=212"
"135","0.787199","10.8.113.245","10.8.227.69","TCP","266","8001  >  50559 [PSH, ACK] Seq=17893 Ack=1185 Win=65280 Len=212"
"136","0.787293","10.8.227.69","10.8.113.245","TCP","54","50559  >  8001 [ACK] Seq=1185 Ack=18105 Win=130560 Len=0"
"137","0.803964","10.8.113.245","10.8.227.69","TCP","266","8001  >  50559 [PSH, ACK] Seq=18105 Ack=1185 Win=65280 Len=212"
"138","0.820433","10.8.113.245","10.8.227.69","TCP","266","8001  >  50559 [PSH, ACK] Seq=18317 Ack=1185 Win=65280 Len=212"
"139","0.820531","10.8.227.69","10.8.113.245","TCP","54","50559  >  8001 [ACK] Seq=1185 Ack=18529 Win=130048 Len=0"
"140","0.837268","10.8.113.245","10.8.227.69","TCP","266","8001  >  50559 [PSH, ACK] Seq=18529 Ack=1185 Win=65280 Len=212"
"141","0.853972","10.8.113.245","10.8.227.69","TCP","266","8001  >  50559 [PSH, ACK] Seq=18741 Ack=1185 Win=65280 Len=212"
"142","0.854081","10.8.227.69","10.8.113.245","TCP","54","50559  >  8001 [ACK] Seq=1185 Ack=18953 Win=129792 Len=0"
"143","0.870404","10.8.113.245","10.8.227.69","TCP","266","8001  >  50559 [PSH, ACK] Seq=18953 Ack=1185 Win=65280 Len=212"
"144","0.886951","10.8.113.245","10.8.227.69","TCP","266","8001  >  50559 [PSH, ACK] Seq=19165 Ack=1185 Win=65280 Len=212"
"145","0.887034","10.8.227.69","10.8.113.245","TCP","54","50559  >  8001 [ACK] Seq=1185 Ack=19377 Win=131072 Len=0"
"146","0.903789","10.8.113.245","10.8.227.69","TCP","266","8001  >  50559 [PSH, ACK] Seq=19377 Ack=1185 Win=65280 Len=212"
"147","0.916645","10.8.227.69","10.8.113.245","UDP","1514","55000  >  8001 Len=1472"
"148","0.916875","10.8.227.69","10.8.113.245","UDP","1498","55000  >  8001 Len=1456"
"149","0.917058","10.8.227.69","10.8.113.245","UDP","1482","55000  >  8001 Len=1440"
"150","0.917243","10.8.227.69","10.8.113.245","UDP","1466","55000  >  8001 Len=1424"
"151","0.917395","10.8.227.69","10.8.113.245","UDP","1450","55000  >  8001 Len=1408"
"152","0.921005","10.8.113.245","10.8.227.69","TCP","266","8001  >  50559 [PSH, ACK] Seq=19589 Ack=1185 Win=65280 Len=212"
"153","0.921075","10.8.227.69","10.8.113.245","TCP","54","50559  >  8001 [ACK] Seq=1185 Ack=19801 Win=130560 Len=0"
"154","0.926796","10.8.113.245","10.8.227.69","IPv4","1514","Fragmented IP protocol (proto=UDP 17, off=0, ID=4b51) [Reassembled in #155]"
"155","0.926798","10.8.113.245","10.8.227.69","UDP","58","8001  >  55000 Len=1496"
"156","0.927201","10.8.227.69","10.8.113.245","UDP","58","55000  >  8001 Len=16"
"157","0.931918","10.8.113.245","10.8.227.69","UDP","58","8001  >  55000 Len=16"
"158","0.933699","10.8.227.69","10.8.113.245","UDP","70","55000  >  8001 Len=28"
"159","0.937095","10.8.113.245","10.8.227.69","TCP","266","8001  >  50559 [PSH, ACK] Seq=19801 Ack=1185 Win=65280 Len=212"
"160","0.938412","10.8.113.245","10.8.227.69","UDP","70","8001  >  55000 Len=28"
"161","0.938784","10.8.227.69","10.8.113.245","UDP","62","55000  >  8001 Len=20"
"162","0.943404","10.8.113.245","10.8.227.69","UDP","58","8001  >  55000 Len=16"
"163","0.955470","10.8.113.245","10.8.227.69","UDP","250","8001  >  55000 Len=208"
"164","0.955918","10.8.227.69","10.8.113.245","UDP","62","55000  >  8001 Len=20"
"165","0.972087","10.8.113.245","10.8.227.69","UDP","250","8001  >  55000 Len=208"
"166","0.972513","10.8.227.69","10.8.113.245","UDP","62","55000  >  8001 Len=20"
"167","0.978294","10.8.227.69","10.8.113.245","TCP","54","50559  >  8001 [ACK] Seq=1185 Ack=20013 Win=130304 Len=0"
"168","0.988903","10.8.113.245","10.8.227.69","UDP","250","8001  >  55000 Len=208"
"169","0.989306","10.8.227.69","10.8.113.245","UDP","62","55000  >  8001 Len=20"
"170","1.005431","10.8.113.245","10.8.227.69","UDP","250","8001  >  55000 Len=208"
"171","1.005863","10.8.227.69","10.8.113.245","UDP","62","55000  >  8001 Len=20"
"172","1.022303","10.8.113.245","10.8.227.69","UDP","250","8001  >  55000 Len=208"
"173","1.022798","10.8.227.69","10.8.113.245","UDP","62","55000  >  8001 Len=20"
"174","1.038802","10.8.113.245","10.8.227.69","UDP","250","8001  >  55000 Len=208"
"175","1.039540","10.8.227.69","10.8.113.245","UDP","62","55000  >  8001 Len=20"
"176","1.055177","10.8.113.245","10.8.227.69","UDP","250","8001  >  55000 Len=208"
"177","1.055552","10.8.227.69","10.8.113.245","UDP","62","55000  >  8001 Len=20"
"178","1.072050","10.8.113.245","10.8.227.69","UDP","250","8001  >  55000 Len=208"
"179","1.072481","10.8.227.69","10.8.113.245","UDP","62","55000  >  8001 Len=20"
"180","1.088863","10.8.113.245","10.8.227.69","UDP","250","8001  >  55000 Len=208"
"181","1.089307","10.8.227.69","10.8.113.245","UDP","62","55000  >  8001 Len=20"
"182","1.106465","10.8.113.245","10.8.227.69","UDP","250","8001  >  55000 Len=208"
"183","1.107131","10.8.227.69","10.8.113.245","UDP","62","55000  >  8001 Len=20"
"184","1.122165","10.8.113.245","10.8.227.69","UDP","250","8001  >  55000 Len=208"
"185","1.122641","10.8.227.69","10.8.113.245","UDP","62","55000  >  8001 Len=20"
"186","1.139098","10.8.113.245","10.8.227.69","UDP","250","8001  >  55000 Len=208"
"187","1.139563","10.8.227.69","10.8.113.245","UDP","62","55000  >  8001 Len=20"
"188","1.155457","10.8.113.245","10.8.227.69","UDP","250","8001  >  55000 Len=208"
"189","1.155942","10.8.227.69","10.8.113.245","UDP","62","55000  >  8001 Len=20"
"190","1.171859","10.8.113.245","10.8.227.69","UDP","250","8001  >  55000 Len=208"
"191","1.172330","10.8.227.69","10.8.113.245","UDP","62","55000  >  8001 Len=20"
"192","1.188512","10.8.113.245","10.8.227.69","UDP","250","8001  >  55000 Len=208"
"193","1.188989","10.8.227.69","10.8.113.245","UDP","62","55000  >  8001 Len=20"
"194","1.205224","10.8.113.245","10.8.227.69","UDP","250","8001  >  55000 Len=208"
"195","1.205704","10.8.227.69","10.8.113.245","UDP","62","55000  >  8001 Len=20"
"196","1.221718","10.8.113.245","10.8.227.69","UDP","250","8001  >  55000 Len=208"
"197","1.222183","10.8.227.69","10.8.113.245","UDP","62","55000  >  8001 Len=20"
"198","1.238402","10.8.113.245","10.8.227.69","UDP","250","8001  >  55000 Len=208"
"199","1.238845","10.8.227.69","10.8.113.245","UDP","62","55000  >  8001 Len=20"
"200","1.255084","10.8.113.245","10.8.227.69","UDP","250","8001  >  55000 Len=208"
"201","1.255556","10.8.227.69","10.8.113.245","UDP","62","55000  >  8001 Len=20"
"202","1.277779","10.8.113.245","10.8.227.69","UDP","250","8001  >  55000 Len=208"
"203","1.278263","10.8.227.69","10.8.113.245","UDP","62","55000  >  8001 Len=20"
"204","1.284970","10.8.113.245","10.8.227.69","TCP","1440","8001  >  50559 [ACK] Seq=20013 Ack=1185 Win=65280 Len=1386"
"205","1.284973","10.8.113.245","10.8.227.69","TCP","160","8001  >  50559 [PSH, ACK] Seq=21399 Ack=1185 Win=65280 Len=106"
"206","1.285077","10.8.227.69","10.8.113.245","TCP","54","50559  >  8001 [ACK] Seq=1185 Ack=21505 Win=131072 Len=0"
"207","1.285779","10.8.113.245","10.8.227.69","TCP","1440","8001  >  50559 [ACK] Seq=21505 Ack=1185 Win=65280 Len=1386"
"208","1.286089","10.8.113.245","10.8.227.69","TCP","1440","8001  >  50559 [ACK] Seq=22891 Ack=1185 Win=65280 Len=1386"
"209","1.286151","10.8.227.69","10.8.113.245","TCP","54","50559  >  8001 [ACK] Seq=1185 Ack=24277 Win=131072 Len=0"
"210","1.286495","10.8.113.245","10.8.227.69","TCP","266","8001  >  50559 [PSH, ACK] Seq=24277 Ack=1185 Win=65280 Len=212"
"211","1.286504","10.8.113.245","10.8.227.69","TCP","1440","8001  >  50559 [ACK] Seq=24489 Ack=1185 Win=65280 Len=1386"
"212","1.286575","10.8.227.69","10.8.113.245","TCP","54","50559  >  8001 [ACK] Seq=1185 Ack=25875 Win=131072 Len=0"
"213","1.286878","10.8.113.245","10.8.227.69","TCP","1440","8001  >  50559 [ACK] Seq=25875 Ack=1185 Win=65280 Len=1386"
"214","1.286880","10.8.113.245","10.8.227.69","TCP","266","8001  >  50559 [PSH, ACK] Seq=27261 Ack=1185 Win=65280 Len=212"
"215","1.286941","10.8.227.69","10.8.113.245","TCP","54","50559  >  8001 [ACK] Seq=1185 Ack=27473 Win=131072 Len=0"
"216","1.288795","10.8.113.245","10.8.227.69","UDP","450","8001  >  55000 Len=408"
"217","1.289294","10.8.227.69","10.8.113.245","UDP","62","55000  >  8001 Len=20"
"218","1.289537","10.8.113.245","10.8.227.69","UDP","250","8001  >  55000 Len=208"
"219","1.289894","10.8.227.69","10.8.113.245","UDP","62","55000  >  8001 Len=20"
"220","1.305004","10.8.113.245","10.8.227.69","UDP","250","8001  >  55000 Len=208"
"221","1.305463","10.8.227.69","10.8.113.245","UDP","62","55000  >  8001 Len=20"
"222","1.321696","10.8.113.245","10.8.227.69","UDP","250","8001  >  55000 Len=208"
"223","1.322175","10.8.227.69","10.8.113.245","UDP","62","55000  >  8001 Len=20"
"224","1.338338","10.8.113.245","10.8.227.69","UDP","250","8001  >  55000 Len=208"
"225","1.338812","10.8.227.69","10.8.113.245","UDP","62","55000  >  8001 Len=20"
"226","1.354962","10.8.113.245","10.8.227.69","UDP","250","8001  >  55000 Len=208"
"227","1.355515","10.8.227.69","10.8.113.245","UDP","62","55000  >  8001 Len=20"
"228","1.371692","10.8.113.245","10.8.227.69","UDP","250","8001  >  55000 Len=208"
"229","1.372177","10.8.227.69","10.8.113.245","UDP","62","55000  >  8001 Len=20"
"230","1.388316","10.8.113.245","10.8.227.69","UDP","250","8001  >  55000 Len=208"
"231","1.388789","10.8.227.69","10.8.113.245","UDP","62","55000  >  8001 Len=20"
"232","1.404922","10.8.113.245","10.8.227.69","UDP","250","8001  >  55000 Len=208"
"233","1.405401","10.8.227.69","10.8.113.245","UDP","62","55000  >  8001 Len=20"
"234","1.421864","10.8.113.245","10.8.227.69","UDP","250","8001  >  55000 Len=208"
"235","1.422343","10.8.227.69","10.8.113.245","UDP","62","55000  >  8001 Len=20"
"236","1.438409","10.8.113.245","10.8.227.69","UDP","250","8001  >  55000 Len=208"
"237","1.438848","10.8.227.69","10.8.113.245","UDP","62","55000  >  8001 Len=20"
"238","1.454935","10.8.113.245","10.8.227.69","UDP","250","8001  >  55000 Len=208"
"239","1.455407","10.8.227.69","10.8.113.245","UDP","62","55000  >  8001 Len=20"
"240","1.471601","10.8.113.245","10.8.227.69","UDP","250","8001  >  55000 Len=208"
"241","1.472067","10.8.227.69","10.8.113.245","UDP","62","55000  >  8001 Len=20"
"242","1.489727","10.8.113.245","10.8.227.69","UDP","250","8001  >  55000 Len=208"
"243","1.490121","10.8.227.69","10.8.113.245","UDP","62","55000  >  8001 Len=20"
"244","1.505037","10.8.113.245","10.8.227.69","UDP","250","8001  >  55000 Len=208"
"245","1.505431","10.8.227.69","10.8.113.245","UDP","62","55000  >  8001 Len=20"
"246","1.521553","10.8.113.245","10.8.227.69","UDP","250","8001  >  55000 Len=208"
"247","1.521847","10.8.227.69","10.8.113.245","UDP","62","55000  >  8001 Len=20"
"248","1.538315","10.8.113.245","10.8.227.69","UDP","250","8001  >  55000 Len=208"
"249","1.538761","10.8.227.69","10.8.113.245","UDP","62","55000  >  8001 Len=20"
"250","1.554761","10.8.113.245","10.8.227.69","UDP","250","8001  >  55000 Len=208"
"251","1.555056","10.8.227.69","10.8.113.245","UDP","62","55000  >  8001 Len=20"
"252","1.571482","10.8.113.245","10.8.227.69","UDP","250","8001  >  55000 Len=208"
"253","1.571763","10.8.227.69","10.8.113.245","UDP","62","55000  >  8001 Len=20"
"254","1.588105","10.8.113.245","10.8.227.69","UDP","250","8001  >  55000 Len=208"
"255","1.588435","10.8.227.69","10.8.113.245","UDP","62","55000  >  8001 Len=20"
"256","1.605124","10.8.113.245","10.8.227.69","UDP","250","8001  >  55000 Len=208"
"257","1.605403","10.8.227.69","10.8.113.245","UDP","62","55000  >  8001 Len=20"
"258","1.621701","10.8.113.245","10.8.227.69","UDP","250","8001  >  55000 Len=208"
"259","1.622005","10.8.227.69","10.8.113.245","UDP","62","55000  >  8001 Len=20"
"260","1.634670","10.8.113.245","10.8.227.69","TCP","1440","8001  >  50559 [ACK] Seq=27473 Ack=1185 Win=65280 Len=1386"
"261","1.635321","10.8.113.245","10.8.227.69","TCP","160","8001  >  50559 [PSH, ACK] Seq=28859 Ack=1185 Win=65280 Len=106"
"262","1.635363","10.8.227.69","10.8.113.245","TCP","54","50559  >  8001 [ACK] Seq=1185 Ack=28965 Win=131072 Len=0"
"263","1.635552","10.8.113.245","10.8.227.69","TCP","1440","8001  >  50559 [ACK] Seq=28965 Ack=1185 Win=65280 Len=1386"
"264","1.635554","10.8.113.245","10.8.227.69","TCP","1440","8001  >  50559 [ACK] Seq=30351 Ack=1185 Win=65280 Len=1386"
"265","1.635558","10.8.113.245","10.8.227.69","TCP","266","8001  >  50559 [PSH, ACK] Seq=31737 Ack=1185 Win=65280 Len=212"
"266","1.635604","10.8.227.69","10.8.113.245","TCP","54","50559  >  8001 [ACK] Seq=1185 Ack=31949 Win=131072 Len=0"
"267","1.636210","10.8.113.245","10.8.227.69","TCP","1440","8001  >  50559 [ACK] Seq=31949 Ack=1185 Win=65280 Len=1386"
"268","1.636238","10.8.227.69","10.8.113.245","TCP","54","50559  >  8001 [ACK] Seq=1185 Ack=33335 Win=131072 Len=0"
"269","1.636713","10.8.113.245","10.8.227.69","TCP","1440","8001  >  50559 [ACK] Seq=33335 Ack=1185 Win=65280 Len=1386"
"270","1.637229","10.8.113.245","10.8.227.69","TCP","266","8001  >  50559 [PSH, ACK] Seq=34721 Ack=1185 Win=65280 Len=212"
"271","1.637263","10.8.227.69","10.8.113.245","TCP","54","50559  >  8001 [ACK] Seq=1185 Ack=34933 Win=131072 Len=0"
"272","1.639346","10.8.113.245","10.8.227.69","UDP","450","8001  >  55000 Len=408"
"273","1.639347","10.8.113.245","10.8.227.69","UDP","250","8001  >  55000 Len=208"
"274","1.639662","10.8.227.69","10.8.113.245","UDP","62","55000  >  8001 Len=20"
"275","1.639862","10.8.227.69","10.8.113.245","UDP","62","55000  >  8001 Len=20"
"276","1.654957","10.8.113.245","10.8.227.69","UDP","250","8001  >  55000 Len=208"
"277","1.655264","10.8.227.69","10.8.113.245","UDP","62","55000  >  8001 Len=20"
"278","1.671910","10.8.113.245","10.8.227.69","UDP","250","8001  >  55000 Len=208"
"279","1.672384","10.8.227.69","10.8.113.245","UDP","62","55000  >  8001 Len=20"
"280","1.688159","10.8.113.245","10.8.227.69","UDP","250","8001  >  55000 Len=208"
"281","1.688641","10.8.227.69","10.8.113.245","UDP","62","55000  >  8001 Len=20"
"282","1.704755","10.8.113.245","10.8.227.69","UDP","250","8001  >  55000 Len=208"
"283","1.705229","10.8.227.69","10.8.113.245","UDP","62","55000  >  8001 Len=20"
"284","1.721467","10.8.113.245","10.8.227.69","UDP","250","8001  >  55000 Len=208"
"285","1.722061","10.8.227.69","10.8.113.245","UDP","62","55000  >  8001 Len=20"
"286","1.728317","10.8.113.245","10.8.227.69","UDP","150","8001  >  55000 Len=108"
"287","1.728818","10.8.227.69","10.8.113.245","UDP","62","55000  >  8001 Len=20"
"288","1.738220","10.8.113.245","10.8.227.69","UDP","250","8001  >  55000 Len=208"
"289","1.738678","10.8.227.69","10.8.113.245","UDP","62","55000  >  8001 Len=20"
"290","1.754757","10.8.113.245","10.8.227.69","UDP","250","8001  >  55000 Len=208"
"291","1.755229","10.8.227.69","10.8.113.245","UDP","62","55000  >  8001 Len=20"
"292","1.771659","10.8.113.245","10.8.227.69","UDP","250","8001  >  55000 Len=208"
"293","1.772142","10.8.227.69","10.8.113.245","UDP","62","55000  >  8001 Len=20"
"294","1.787991","10.8.113.245","10.8.227.69","UDP","250","8001  >  55000 Len=208"
"295","1.788470","10.8.227.69","10.8.113.245","UDP","62","55000  >  8001 Len=20"
"296","1.810249","10.8.113.245","10.8.227.69","UDP","250","8001  >  55000 Len=208"
"297","1.810730","10.8.227.69","10.8.113.245","UDP","62","55000  >  8001 Len=20"
"298","1.823168","10.8.113.245","10.8.227.69","UDP","250","8001  >  55000 Len=208"
"299","1.823641","10.8.227.69","10.8.113.245","UDP","62","55000  >  8001 Len=20"
"300","1.838057","10.8.113.245","10.8.227.69","UDP","250","8001  >  55000 Len=208"
"301","1.838540","10.8.227.69","10.8.113.245","UDP","62","55000  >  8001 Len=20"
"302","1.854665","10.8.113.245","10.8.227.69","UDP","250","8001  >  55000 Len=208"
"303","1.855136","10.8.227.69","10.8.113.245","UDP","62","55000  >  8001 Len=20"
"304","1.871391","10.8.113.245","10.8.227.69","UDP","250","8001  >  55000 Len=208"
"305","1.871891","10.8.227.69","10.8.113.245","UDP","62","55000  >  8001 Len=20"
"306","1.887975","10.8.113.245","10.8.227.69","UDP","250","8001  >  55000 Len=208"
"307","1.888490","10.8.227.69","10.8.113.245","UDP","62","55000  >  8001 Len=20"
"308","1.904629","10.8.113.245","10.8.227.69","UDP","250","8001  >  55000 Len=208"
"309","1.905111","10.8.227.69","10.8.113.245","UDP","62","55000  >  8001 Len=20"
"310","1.921516","10.8.113.245","10.8.227.69","UDP","250","8001  >  55000 Len=208"
"311","1.922009","10.8.227.69","10.8.113.245","UDP","62","55000  >  8001 Len=20"
"312","1.938327","10.8.113.245","10.8.227.69","UDP","250","8001  >  55000 Len=208"
"313","1.938772","10.8.227.69","10.8.113.245","UDP","62","55000  >  8001 Len=20"
"314","1.954748","10.8.113.245","10.8.227.69","UDP","250","8001  >  55000 Len=208"
"315","1.955339","10.8.227.69","10.8.113.245","UDP","62","55000  >  8001 Len=20"
"316","1.967586","10.8.113.245","10.8.227.69","TCP","1440","8001  >  50559 [ACK] Seq=34933 Ack=1185 Win=65280 Len=1386"
"317","1.967588","10.8.113.245","10.8.227.69","TCP","160","8001  >  50559 [PSH, ACK] Seq=36319 Ack=1185 Win=65280 Len=106"
"318","1.967702","10.8.227.69","10.8.113.245","TCP","54","50559  >  8001 [ACK] Seq=1185 Ack=36425 Win=131072 Len=0"
"319","1.968874","10.8.113.245","10.8.227.69","TCP","1440","8001  >  50559 [ACK] Seq=36425 Ack=1185 Win=65280 Len=1386"
"320","1.969930","10.8.113.245","10.8.227.69","TCP","1440","8001  >  50559 [ACK] Seq=37811 Ack=1185 Win=65280 Len=1386"
"321","1.969932","10.8.113.245","10.8.227.69","TCP","266","8001  >  50559 [PSH, ACK] Seq=39197 Ack=1185 Win=65280 Len=212"
"322","1.969933","10.8.113.245","10.8.227.69","TCP","1440","8001  >  50559 [ACK] Seq=39409 Ack=1185 Win=65280 Len=1386"
"323","1.969938","10.8.113.245","10.8.227.69","TCP","1440","8001  >  50559 [ACK] Seq=40795 Ack=1185 Win=65280 Len=1386"
"324","1.969939","10.8.113.245","10.8.227.69","TCP","266","8001  >  50559 [PSH, ACK] Seq=42181 Ack=1185 Win=65280 Len=212"
"325","1.970045","10.8.227.69","10.8.113.245","TCP","54","50559  >  8001 [ACK] Seq=1185 Ack=42393 Win=131072 Len=0"
"326","1.970960","10.8.113.245","10.8.227.69","UDP","450","8001  >  55000 Len=408"
"327","1.971402","10.8.227.69","10.8.113.245","UDP","62","55000  >  8001 Len=20"
"328","1.972201","10.8.113.245","10.8.227.69","UDP","250","8001  >  55000 Len=208"
"329","1.972547","10.8.227.69","10.8.113.245","UDP","62","55000  >  8001 Len=20"
"330","1.988016","10.8.113.245","10.8.227.69","UDP","250","8001  >  55000 Len=208"
"331","1.988528","10.8.227.69","10.8.113.245","UDP","62","55000  >  8001 Len=20"
"332","2.004756","10.8.113.245","10.8.227.69","UDP","250","8001  >  55000 Len=208"
"333","2.005234","10.8.227.69","10.8.113.245","UDP","62","55000  >  8001 Len=20"
"334","2.021505","10.8.113.245","10.8.227.69","UDP","250","8001  >  55000 Len=208"
"335","2.021982","10.8.227.69","10.8.113.245","UDP","62","55000  >  8001 Len=20"
"336","2.038027","10.8.113.245","10.8.227.69","UDP","250","8001  >  55000 Len=208"
"337","2.038519","10.8.227.69","10.8.113.245","UDP","62","55000  >  8001 Len=20"
"338","2.054873","10.8.113.245","10.8.227.69","UDP","250","8001  >  55000 Len=208"
"339","2.055362","10.8.227.69","10.8.113.245","UDP","62","55000  >  8001 Len=20"
"340","2.071316","10.8.113.245","10.8.227.69","UDP","250","8001  >  55000 Len=208"
"341","2.071783","10.8.227.69","10.8.113.245","UDP","62","55000  >  8001 Len=20"
"342","2.088579","10.8.113.245","10.8.227.69","UDP","250","8001  >  55000 Len=208"
"343","2.089036","10.8.227.69","10.8.113.245","UDP","62","55000  >  8001 Len=20"
"344","2.104905","10.8.113.245","10.8.227.69","UDP","250","8001  >  55000 Len=208"
"345","2.105304","10.8.227.69","10.8.113.245","UDP","62","55000  >  8001 Len=20"
"346","2.121135","10.8.113.245","10.8.227.69","UDP","250","8001  >  55000 Len=208"
"347","2.121603","10.8.227.69","10.8.113.245","UDP","62","55000  >  8001 Len=20"
"348","2.137977","10.8.113.245","10.8.227.69","UDP","250","8001  >  55000 Len=208"
"349","2.138365","10.8.227.69","10.8.113.245","UDP","62","55000  >  8001 Len=20"
"350","2.154684","10.8.113.245","10.8.227.69","UDP","250","8001  >  55000 Len=208"
"351","2.155064","10.8.227.69","10.8.113.245","UDP","62","55000  >  8001 Len=20"
"352","2.171576","10.8.113.245","10.8.227.69","UDP","250","8001  >  55000 Len=208"
"353","2.171865","10.8.227.69","10.8.113.245","UDP","62","55000  >  8001 Len=20"
"354","2.187966","10.8.113.245","10.8.227.69","UDP","250","8001  >  55000 Len=208"
"355","2.188369","10.8.227.69","10.8.113.245","UDP","62","55000  >  8001 Len=20"
"356","2.204254","10.8.113.245","10.8.227.69","UDP","250","8001  >  55000 Len=208"
"357","2.204689","10.8.227.69","10.8.113.245","UDP","62","55000  >  8001 Len=20"
"358","2.221121","10.8.113.245","10.8.227.69","UDP","250","8001  >  55000 Len=208"
"359","2.221596","10.8.227.69","10.8.113.245","UDP","62","55000  >  8001 Len=20"
"360","2.240332","10.8.113.245","10.8.227.69","UDP","250","8001  >  55000 Len=208"
"361","2.240812","10.8.227.69","10.8.113.245","UDP","62","55000  >  8001 Len=20"
"362","2.254717","10.8.113.245","10.8.227.69","UDP","250","8001  >  55000 Len=208"
"363","2.255193","10.8.227.69","10.8.113.245","UDP","62","55000  >  8001 Len=20"
"364","2.271313","10.8.113.245","10.8.227.69","UDP","250","8001  >  55000 Len=208"
"365","2.271800","10.8.227.69","10.8.113.245","UDP","62","55000  >  8001 Len=20"
"366","2.288393","10.8.113.245","10.8.227.69","UDP","250","8001  >  55000 Len=208"
"367","2.288868","10.8.227.69","10.8.113.245","UDP","62","55000  >  8001 Len=20"
"368","2.304789","10.8.113.245","10.8.227.69","UDP","250","8001  >  55000 Len=208"
"369","2.305284","10.8.227.69","10.8.113.245","UDP","62","55000  >  8001 Len=20"
"370","2.321314","10.8.113.245","10.8.227.69","UDP","250","8001  >  55000 Len=208"
"371","2.321797","10.8.227.69","10.8.113.245","UDP","62","55000  >  8001 Len=20"
"372","2.337605","10.8.113.245","10.8.227.69","UDP","250","8001  >  55000 Len=208"
"373","2.338088","10.8.227.69","10.8.113.245","UDP","62","55000  >  8001 Len=20"
"374","2.426516","10.8.113.245","10.8.227.69","UDP","250","8001  >  55000 Len=208"
"375","2.426519","10.8.113.245","10.8.227.69","UDP","250","8001  >  55000 Len=208"
"376","2.426906","10.8.113.245","10.8.227.69","UDP","250","8001  >  55000 Len=208"
"377","2.426909","10.8.113.245","10.8.227.69","UDP","250","8001  >  55000 Len=208"
"378","2.427140","10.8.227.69","10.8.113.245","UDP","62","55000  >  8001 Len=20"
"379","2.427416","10.8.227.69","10.8.113.245","UDP","62","55000  >  8001 Len=20"
"380","2.427716","10.8.227.69","10.8.113.245","UDP","62","55000  >  8001 Len=20"
"381","2.431799","10.8.113.245","10.8.227.69","UDP","250","8001  >  55000 Len=208"
"382","2.432293","10.8.227.69","10.8.113.245","UDP","62","55000  >  8001 Len=20"
"383","2.438075","10.8.113.245","10.8.227.69","UDP","250","8001  >  55000 Len=208"
"384","2.438542","10.8.227.69","10.8.113.245","UDP","62","55000  >  8001 Len=20"
"385","2.455913","10.8.113.245","10.8.227.69","UDP","250","8001  >  55000 Len=208"
"386","2.456369","10.8.227.69","10.8.113.245","UDP","62","55000  >  8001 Len=20"
"387","2.474840","10.8.113.245","10.8.227.69","UDP","250","8001  >  55000 Len=208"
"388","2.475389","10.8.227.69","10.8.113.245","UDP","62","55000  >  8001 Len=20"
"389","2.487700","10.8.113.245","10.8.227.69","UDP","250","8001  >  55000 Len=208"
"390","2.488182","10.8.227.69","10.8.113.245","UDP","62","55000  >  8001 Len=20"
"391","2.504437","10.8.113.245","10.8.227.69","UDP","250","8001  >  55000 Len=208"
"392","2.504828","10.8.227.69","10.8.113.245","UDP","62","55000  >  8001 Len=20"
"393","2.520984","10.8.113.245","10.8.227.69","UDP","250","8001  >  55000 Len=208"
"394","2.521457","10.8.227.69","10.8.113.245","UDP","62","55000  >  8001 Len=20"
"395","2.539894","10.8.113.245","10.8.227.69","UDP","250","8001  >  55000 Len=208"
"396","2.540328","10.8.227.69","10.8.113.245","UDP","62","55000  >  8001 Len=20"
"397","2.554237","10.8.113.245","10.8.227.69","UDP","250","8001  >  55000 Len=208"
"398","2.554622","10.8.227.69","10.8.113.245","UDP","62","55000  >  8001 Len=20"
"399","2.571363","10.8.113.245","10.8.227.69","UDP","250","8001  >  55000 Len=208"
"400","2.571864","10.8.227.69","10.8.113.245","UDP","62","55000  >  8001 Len=20"
"401","2.587339","10.8.113.245","10.8.227.69","UDP","250","8001  >  55000 Len=208"
"402","2.587907","10.8.227.69","10.8.113.245","UDP","62","55000  >  8001 Len=20"
"403","2.604232","10.8.113.245","10.8.227.69","UDP","250","8001  >  55000 Len=208"
